message,source
Such reports are reviewed regularly by the malaria control authorities.,FMOH
The rational use of antimalarial medicines refers to appropriate use of antimalarials for the right indications and at the correct/adequate dosages.,FMOH
"Antimalarial medicines will be needed for the treatment of uncomplicated malaria, severe malaria and chemoprophylaxis for groups at risk.",FMOH
The appropriate use of antimalarial medicines is determined by the goal of treatment and the person responsible for taking the primary decision on use of such medicines either at home or at the different health care levels.,FMOH
"It is the practice, decision and action that occur at this level that influence the management of uncomplicated malaria.",FMOH
"Components of CMM include community education, adequate training of care-givers and the patent medicine vendors and the repositioning of diagnostics, medicines and all other tools.",FMOH
"The effectiveness of community based management will depend upon early diagnosis, prompt and appropriate treatment, and proper health education about malaria.",FMOH
"Early commencement of appropriate treatment will ensure better outcome, and prevent the progression to severe malaria.",FMOH
"An antimalarial medicine to be used at home must be safe, effective, affordable, easy to administer and preferably, in single dosage packs.",FMOH
"All approved Artemisinin-based Combination Therapies come in colour-coded, age specific packs and simple to administer dosage regimen.",FMOH
"At the community level, the Role Model Care Givers and trained Patent Medicine Vendors have been empowered to administered antimalarial medicines, especially in children less than five years presenting with symptoms of malaria.",FMOH
"Diagnosis of malaria in children less than five years at home will depend on proper recognition of symptoms and signs such as fever, vomiting and loss of appetite.",FMOH
The care providers at this level will be trained on the use of malaria Rapid Diagnostic Tests to improve diagnosis and also prevent wastage.,FMOH
They will be taught to recognize signs of severe malaria for which they must immediately bring a child to the nearest health facility.,FMOH
Pre-referral services will be improved upon to ensure that patients with possible severe malaria receive pre-referral treatment promptly.,FMOH
Medicines are to be taken every day for three days.,FMOH
"In communities where caregivers have been trained on the administration of Rectal Artesunate, the appropriate dosage should be given as pre-referral treatment.",FMOH
"In all cases, all medicines administered must be appropriately documented in the register provided.",FMOH
"Disease Management in Health Facilities: Levels I, II and III. ",FMOH
"Level I: At the Primary Health Care Centres, Dispensaries and Health Posts, the Village Health Workers, Junior Community Health Extension Workers or trained Patent Medicine Vendors (PMV) belong to this level.",FMOH
Capacity for laboratory diagnosis of malaria at this level is usually limited.,FMOH
"In addition to the treatment of uncomplicated malaria as described above, under community management, a health worker at this level shall give Artesunate suppositories or intramuscular Quinine as pre-referral treatment.",FMOH
"In facilities where there are neither microscopes nor Rapid Diagnostic Tests, malaria diagnosis in children less than five years shall be based on clinical symptoms using the IMCI classification.",FMOH
"The health worker should be able to recognize the general danger signs, give pre-referral treatment such as Artesunate suppositories or intramuscular Quinine and promptly refer patients with severe febrile disease.",FMOH
"Level II: General Hospitals, Comprehensive Health Centres, etc and Private Hospitals staffed by Medical Officers, Community Health Officers or Nurses, At this level, there may or may not be a laboratory.",FMOH
"It is, however, desirable that a laboratory diagnosis of malaria be established when possible.",FMOH
"Detailed history, physical examination and laboratory tests would be employed in the diagnosis of malaria in order to exclude other possible conditions, treatment failure and complications.",FMOH
Rapid Diagnostic Tests shall be provided to compliment microscopy.,FMOH
"Management capabilities would include using alternative antimalarials for failure of response to recommended medicine, providing urgent treatment for severe malaria or other severe febrile illnesses.",FMOH
"Level III: Specialist, Teaching Hospitals and Some Categories of Private Hospitals.",FMOH
"Three categories of patients may be anticipated at this level: patients presenting for the first time, those visiting for follow-up of the same illness, and those referred from other levels that have failed to respond to therapy or have severe complications.",FMOH
"The management of malaria at this level would focus on confirming diagnosis, giving the most effective treatment (including the use of appropriate antimalarial medicines where necessary), providing intensive care for patients with severe complications, and laboratory monitoring.",FMOH
"Therefore, this level must be appropriately staffed and well equipped with needed medicines and laboratory supplies.",FMOH
Level III facilities with units providing primary health care services shall be provided with Rapid Diagnostic Tests in addition to laboratory diagnosis using microscopes.,FMOH
Quality Control mechanisms shall be set up at both Levels two and three facilities.,FMOH
The referral system starts from the caregiver at home who should visit the nearest health facility as soon as there is no perceivable response within two days of commencement of treatment without improvement or when the patient seems to be getting worse.,FMOH
"In general, health providers and health workers at all levels should be able to recognize their limitations and make early referrals.",FMOH
Referral should be a two way process whereby the health worker at the higher health facility also endeavors to give feedback to the lower level health facility on the outcome of the patients management.,FMOH
PREVENTIVE USE OF ANTIMALARIAL MEDICINES: Malaria prophylaxis is generally not necessary in persons living in a malaria endemic area because it may slow down the ability of the individual to develop partial immunity which protects from developing the severe form of the disease.,FMOH
"IPTp with SP in Pregnant Women In high transmission areas such as Nigeria, malaria may be asymptomatic during pregnancy.",FMOH
"The use of Intermittent Preventive Therapy with Sulfadoxine- Pyrimethamine has been used for several years in parts of Africa, and has shown to be effective.",FMOH
This is an evidence-based approach and is recommended for all pregnant women.,FMOH
IPT is administered as a one-dose preventive treatment course after Quickening as Directly Observed Therapy and the second dose is given not earlier than one month after the first dose.,FMOH
"Pregnant women who are HIV positive and are on Co-trimoxazole chemoprophylaxis, should not receive IPT with SP.",FMOH
They should be encouraged to use other preventive measures such as regular use of Long Lasting Insecticide Nets.,FMOH
Children and Adults with Sickle Cell Anaemia: Recent evidences have shown that Proguanil no longer protect individuals with sickle cell anaemia against malaria,FMOH
All individuals with Sickle Cell Anaemia are to sleep under Longer Lasting Insecticidal Nets and also treat all confirmed cases of malaria promptly with Artemisinin-based Combination Therapies.,FMOH
Non-immune visitors to areas of malaria transmission are considered to be at high risk of malaria infection.,FMOH
"In addition to the provision of information concerning effective measures to reduce human mosquito contact, non-immune visitors to Nigeria should also be given chemoprophylaxis.",FMOH
Recommended options for non-immune travelers coming to Nigeria include Mefloquine and Atovaquone-Proguanil.,FMOH
Nigerians who have been away from the country for two or more years to non malaria endemic regions such as Europe tend to lose the partial immunity acquired over the years before travelling.,FMOH
Doses should be taken prior to arrival in Nigeria and continued during stay in Nigeria and following departure from the country.,FMOH
"In spite of this, if an individual develops malaria, a full course of an appropriate antimalarial medicine should be taken and it is advised that the patient visit the nearest hospital.",FMOH
"Although, Artemisinin based Combination Therapies have been deployed for the treatment of malaria in Nigeria because of their proven efficacies, there is need to use all medicines with caution.",FMOH
"Artemisinin based medicines though with good track records of safety, are entirely new in sub-Saharan Africa and have not been adequately studied amongst the indigenous population to determine their safety.",FMOH
"It, therefore, behoves all prescribers and users to report any adverse drug reaction(s) or untoward effect(s) that may be noticed when these medicines are used.",FMOH
The National Malaria Control Programme collaborates with the National Pharmacovigilance Unit of the National Foods and Drugs Administration and Control to build the capacity of health care providers in the country.,FMOH
"In all suspected cases of adverse drug reactions, the Pharmacovigilance form should be completed at all levels of care.",FMOH
It is necessary to complete all section of the adverse drug reaction form before submitting or sent to the Centre.,FMOH
"THE THERAPEUTIC EFFICACY MONITORING OF ANTIMALARIAL MEDICINES: In the last two decades, there has been a widespread resistance to Chloroquine and Sulphadoxine-pyrimethamine which had been the first and second line antimalarial medicines respectively.",FMOH
Evidence from the drug therapeutic studies conducted in year two thousand and two in six sites in the country showed a high level of resistance greater than sixty percent for Chloroquine and equally high resistance level for Sulphadoxine-pyrimethamine.,FMOH
"In response to this development, the country reviewed its treatment policy and adopted the Artemisinin based Combination Therapies Artemisinin-based Combination Therapies for the treatment of uncomplicated malaria since year two thousand and five.",FMOH
"The increasing rate at which antimalarial medicines have developed resistance over the last few decades has further increased the need for monitoring and establishment of surveillance system, The sentinel sites have also been increased from the initial six to 14 with at least two sites per zone.",FMOH
Drug Therapeutic Efficacy Studies are conducted biennially with seven of the sites used alternatively.,FMOH
The National Programme is upgrading all the sites to Sentinel Surveillance Centres.,FMOH
PROPERTIES OF ANTIMALARIAL MEDICINES IN USE IN NIGERIA: The salient pharmacological properties of the antimalarial medicines currently in use in Nigeria are shown in tabular form below.,FMOH
"Except for Chloroquine and Quinine, the pharmacokinetics and the pharmacodynamic properties of many of the antimalarial medicines in use in Nigeria have not been studied in-depth in the indigenous population.",FMOH
It is essential that these be done.,FMOH
Artemisinin derivatives All artemisinin derivative medicines are schizonticidal.,FMOH
"Prevent gametocytogenesis by effect on ring and early (stage I and III) gametocyte stages Artemisinins are not are not administered as monotherapies except when used parenterally for the treatment of severe malaria  Absorption: oral very rapid, but may be incomplete.",FMOH
THE MANAGEMENT OF ANTIMALARIAL MEDICINES SUPPLY: Malaria control in Nigeria is anchored primarily on early diagnosis and on prompt and effective treatment of cases.,FMOH
"Successful implementation of the malaria treatment policy would depend upon the availability, accessibility and affordability of the antimalarial medicines needed at all levels of the health care system.",FMOH
"In effect, there should be a regular supply of the medicines at all health care facilities and the people using them should be able to afford them.",FMOH
"A reliable antimalarial medicine supply system should, therefore, be set up, beginning from the procurement stage (through national manufacture or importation), donations (by bilateral and multilateral donors and governments), through storage to ultimate distribution to end users.",FMOH
"The purchase of Artemisinin-based Combination Therapies shall be carried out centrally by appropriate authorities at the National and State level, through pooled procurement.",FMOH
"Procurement of antimalarial medicines shall reflect the two approved medicines, in such that the alternate medicine is available to take care of possible treatment failures and also for a certain proportion of the population that may not tolerate the medicine of choice.",FMOH
The supply of antimalarial medicines to the country shall be either through local manufacture or importation.,FMOH
The private sector would be encouraged to manufacture antimalaria medicines.,FMOH
"Some antimalarials are already being manufactured in Nigeria, albeit from bulk product rather than from basic raw materials.",FMOH
These companies should be encouraged and assisted to invest in the primary manufacture of co-formulated Artemisinin-based Combination Therapies and other antimalarial medicines recommended in this National Policy.,FMOH
"Donations of antimalarial medicines to Nigerian government at state or federal level, shall reflect the recommendations of the National Policy on Diagnosis and Treatment of Malaria.",FMOH
"However, other antimalarial medicines with proven efficacy and approved by the World Health Organization such as Dihydroartemisinin-Piperaquine, Artesunate-Mefloquine etc, donated to the Federal Government shall be provided to Nigerian institutions for research purposes.",FMOH
"All antimalarial medicines should be prepackaged in age specific treatment courses and made available in colour-coded packs, in line with the nationally approved colours for the different age groups of the population.",FMOH
Antimalarial medicines will be stored as far peripherally as possible in the supply chain.,FMOH
"Appropriate storage conditions should, therefore, be met at every storage point to ensure the shelf life of the medicines are preserved.",FMOH
"Appropriate facilities would be provided at each storage point (for example, State, Central Medical Stores, hospital, clinic or community stores) to ensure that the medicines are kept near as optimum condition as possible.",FMOH
Provision shall also be made for the appropriate stocking of antimalarial medicines within the communities for easy access.,FMOH
The test of the effectiveness of the antimalarial medicine supply chain is how available and accessible the medicines are to the end users.,FMOH
The National Malaria Programme shall collaborate with partners and stakeholders to ensure that antimalarial medicines and other commodities are distributed using the already developed distribution framework.,FMOH
All medicines provided by the Federal Government to the public facilities shall be at no cost to the clients.,FMOH
"However, the Federal Government has put machinery in place to ensure that the approved medicines are available through the private sector at highly reduced cost to further improve access.",FMOH
"INFORMATION, EDUCATION AND COMMUNICATION /BCC: The ultimate aim of Information, education and communication is to ensure that individuals, families, communities and health workers are taking preventive measures to prevent the disease, improve on their recognition of malaria and use antimalarial medicines rationally.",FMOH
Concerted efforts should be put in place to promote the use of Artemisinin-based Combination Therapies.,FMOH
"Intensive BCC and capacity development should be directed towards consumers and all cadres of health providers, using a combination of approaches and strategies, as described below.",FMOH
"The key approaches of the Information, education and communication/BCC strategy being adopted for malaria control in Nigeria shall include:  Advocacy: Malaria is a major public health concern, which will require a concerted efforts of all stakeholders in order to control it.",FMOH
The messages should be disseminated through the most effective means of communication in relation to the target audience.,FMOH
"Options include thirty posters, pamphlets, the mass media (print and broadcast), special announcement in places of worship, etc;  Monitoring and evaluation of Information, education and communication efforts: Evaluation effectiveness would be vital to every Information, education and communication efforts.",FMOH
"There is a particular need to evaluate specific Information, education and communication messages in order to get feedback from the communities on the impact of the Information, education and communication initiatives and  Applied research: ",FMOH
This would be conducted by focusing on areas where gaps in antimalarial information currently exist.,FMOH
Effective monitoring and evaluation of Nigerias antimalarial treatment policy is needed to ensure its continuing relevance to combating the malaria menace into the country.,FMOH
"The influence of patient compliance on treatment effectiveness, and the implications for treatment policy; and  The influence of prescriber compliance on treatment effectiveness (i.e.",FMOH
Assessment of medicine tolerance and adverse drug reactions (pharmacovigilance) to determine:  The types and frequency of medicine effects (e.g.,FMOH
"vomiting, diarrhoea) which influence absorption and therapeutic efficacy of the medicines; and  ",FMOH
The types and frequency of medicine effects which compromise correct disease management ,FMOH
This assessment may be done through the sentinel sites and surveys.,FMOH
Monitoring the sensitivity of malaria parasites to antimalarial medicines in vivo.,FMOH
"Institute and strengthen supportive supervision, with an appropriate feedback mechanism, in collaboration with relevant departments and agencies.",FMOH
Monitoring and evaluation should be built into all intervention activities and should be considered and approved at the same time that the activities are being approved.,FMOH
"Process and outcome indicators should be developed as the work-plan is being prepared, and should be fully described in the work plan.",FMOH
"The antimalarial treatment policy of a country should be supported by well focused coordinated research and development strategies if it is to succeed in reducing morbidity and mortality, as well as the cost of treatment to the population.",FMOH
The research in every instance must be need driven.,FMOH
"Government, other relevant national organization and collaborating international agencies should actively support the funding of research on malaria in Nigeria.",FMOH
"In Nigeria, research efforts have typically focused mainly on studies designed to evaluate the efficacy and safety of antimalarial medicines, and even then, such research has been on a low scale.",FMOH
"There is an urgent need to invest in other areas of research, as listed above; on a sustainable basis.",FMOH
"In order to attain the objectives of the National Policy on Diagnosis and Treatment of Malaria, there should be appropriate and adequate deployment of funds to malaria control.",FMOH
"Funds would be needed to facilitate the implementation of preventive measures, ensure medicine availability and effective distribution at all levels, capacity building, and improved referral from one health care level to another.",FMOH
"There would also be the need to provide funds for the monitoring and evaluation of all aspects of malaria control, for social mobilization, and for Operations Research",FMOH
"Funding for malaria control would be provided by the Federal, State and Local governments.",FMOH
"Appropriate proportion of the health budget of each tier of government, based on the precise gravity of the malaria burden and malaria related needs, shall be allocated and released by all tiers of government for malaria control, as and when the fund shall be required.",FMOH
"Others envisaged sources of funds include international and local non-governmental development agencies and organizations, communities and philanthropic individuals.",FMOH
The objective of this policy document is to facilitate and standardize the diagnosis and treatment of malaria and its prevention in the country.,FMOH
"It would improve malaria control, through prompt access to appropriate and effective treatment, using the recommended Artemisinin based Combination Therapy Artemisinin-based Combination Therapies.",FMOH
"It is hoped that strict adherence to this policy would help achieve the goal of the Roll Back Malaria initiative, as stated in the Abuja Declaration.",FMOH
This document is strongly recommended to all stakeholders at all levels in the scaling up of malaria control interventions in Nigeria.,FMOH
"On Saturday, twenty forth January year one thousand nine hundred and seventy six, the Neurology Service was consulted to evaluate the patient's mental status which had still not returned to baseline despite the weaning of sedation.",AfriSpeech
Ultrasound examination of the liver reveals pyogenic abscesses as round or oval hypoechoic lesions with well-defined borders and a variable number of internal echoes.,AfriSpeech
"On the outskirts of the town is Scotlands first privately run prison, Her Majesty Prison Kilmarnock.",AfriSpeech
Plan - needs encouragement to cough and deep breath; and to start Amiodarone medication drops or infusion,AfriSpeech
"Disorder of amniotic fluid and membranes, unspecified, second trimester. Tablet, oral Sandril, Reserpinezero point one milligram. Mechanical loosening of internal left knee prosthetic joint, subsequence",AfriSpeech
Patient heart decreased and cardiac output index increased post operation.,AfriSpeech
"smoking, infection, prior hospitalization, etc.",AfriSpeech
"Biopsy is useful also to exclude adherent bacterial plaques, which may also develop in patients with renal failure.",AfriSpeech
"Infectious mononucleosis, human immunodeficiency virus, tuberculosis lymph nodes can be reactive to infection and are usually smooth, mobile and tender posterior triangle lymph nodes: Malignant or Benign.",AfriSpeech
Reduced prefrontal activity predicts exaggerated striatal dopaminergic function in schizophrenia.,AfriSpeech
"Glucotrol ten medication, every morning and with vitamins",AfriSpeech
He comes to the intensive care unit with dyspnea hypoxemia and radiographic infiltrates.,AfriSpeech
"Reportedly took one hundred and fifty tablets of Tylenol , post meridian around nine o'clock in the night on twenty second April, found covered in emesis with pill fragments at eight thirty this morning.",AfriSpeech
"However, this disease is no longer a significant risk factor.",AfriSpeech
Left shoulder hemiarthroplasty .,AfriSpeech
Widespread bone destruction followed straightforward extraction of the posterior teeth.,AfriSpeech
"Fondaparinux medication combined with intermittent pneumatic compression, versus intermittent pneumatic compression alone, for the prevention of venous thromboembolism after abdominal surgery: is a randomized, double-blind comparison.",AfriSpeech
"What is your new initiative called Wicrypt , and what makes it stand out?",AfriSpeech
Hypoalbuminaemia affects the kinetics of several drugs through its effects on protein binding and causes an apparently inadequate intravascular volume in the face of fluid overload in the body as a whole.,AfriSpeech
Outpatient care centre feels he is having hot/cool flashes.,AfriSpeech
"On lower dose, patient follows simple commands nods appropriately but coughing frequently and ventilating with difficulty.",AfriSpeech
"Laterally, the borders of this region are the pharyngeal constrictors and the medial aspect of the mandible.",AfriSpeech
Arterial Blood Gas at time of incident acceptable.,AfriSpeech
"Failed or difficult intubation, sequela. Injectable, injection Cimetidine Hydrochloride in Sodium Chloride zero point nine percent in plastic container, Cimetidine Hydrochloride, equivalent three hundred and sixty miligram per base per one hundred milliliter. Salter-Harris Type II physeal fracture of lower end of right tibia",AfriSpeech
"Endoscopy: Patient has Insulin, glucose tolerance test medication - Titrated",AfriSpeech
"My mother became pregnant in Idogo and she was coming for her clinical examinations at Massey Street Childrens Hospital, in Lagos.",AfriSpeech
I shall here simply point out that Genoa does not fit into this account.,AfriSpeech
Circulation and Defense Afterload is the sum of all forces a ventricle must overcome before it can eject blood.,AfriSpeech
Plan per Team is to hold for few days right neck edema.,AfriSpeech
"The suspect was taken to the hospital as a precautionary measure, but he is facing driving under the influence (DUI) charges and evading arrest.",AfriSpeech
Faecal concentration techniques.,AfriSpeech
"RESPIRATORY CARE NOTE - Baby Kamfeechukwu twin 2 born via caeserian section (CS) at twenty eight weeks, apgars six and seven, weight four hundred and eighty five grams.",AfriSpeech
Voiding passed loose green stool; heme negative.,AfriSpeech
"She reported fatigue and anorexia for the past few days and had noticed foul smelling urine and some abdominal distension, similar to prior episodes of pyelo .",AfriSpeech
Vitamin Toxity - Toxic effects have been observed when large dosages of some vitamins are ingested.,AfriSpeech
A five to six centimetre incision is made through the platysma.,AfriSpeech
The aneurysm detection and management study screening program: validation cohort and final results.,AfriSpeech
Continued on home bupropion lamotrigine setraline and lorazepam.,AfriSpeech
