message,source
"This should be done before widespread partner drug failure is
reported in order to ensure the availability of alternative treatments.",World Health Organization. (2022). Strategy to respond to antimalarial drug resistance in Africa. 
"Pillar II - Intervention three: Prevent exposure to subtherapeutic drug levels driven by
substandard and falsified Artemisinin-based Combination Therapies by promoting drug quality
Underlying issue
Many factors affect the quality and efficacy of antimalarial drugs.",World Health Organization. (2022). Strategy to respond to antimalarial drug resistance in Africa. 
"Sub-therapeutic drug
dosage could be due to improper manufacturing, for example in the case of inadequate active
pharmaceutical ingredient concentration; alteration, for instance due to poor storage and
distribution conditions, in particular under tropical conditions; or plain falsification.",World Health Organization. (2022). Strategy to respond to antimalarial drug resistance in Africa. 
"Exposing parasites to sub-therapeutic drug levels increases the risk of selection and spread
of resistant parasites.",World Health Organization. (2022). Strategy to respond to antimalarial drug resistance in Africa. 
"Despite the measures put in place in the past, substandard and
falsified drugs are widely available in Africa, especially in the private sector.",World Health Organization. (2022). Strategy to respond to antimalarial drug resistance in Africa. 
"Suggested interventions
Establish a stringent regulatory framework on product quality standards for both imported and
exported Artemisinin-based Combination Therapies: stringent regulation can be achieved by empowering regulatory authorities
within each country.",World Health Organization. (2022). Strategy to respond to antimalarial drug resistance in Africa. 
"Quality assurance of generic Artemisinin-based Combination Therapies can be supported following World Health Organization
standards such as prequalification.",World Health Organization. (2022). Strategy to respond to antimalarial drug resistance in Africa. 
"In addition, a regional harmonization process of
regulatory systems should be strongly encouraged to ensure consistent quality standards in the
region, for instance by ratifying the Treaty for the Establishment of the African Medicines
Agency.",World Health Organization. (2022). Strategy to respond to antimalarial drug resistance in Africa. 
"Monitor and promote the quality of Artemisinin-based Combination Therapies: robust national post-market quality surveillance
programmes should be in place.",World Health Organization. (2022). Strategy to respond to antimalarial drug resistance in Africa. 
"The quality of Artemisinin-based Combination Therapies should be monitored and managed
along the supply chain, through sampling and testing at targeted locations, such as at
customs, in storage locations, throughout the distribution network, and at points of sale in
both public and private sector outlets.",World Health Organization. (2022). Strategy to respond to antimalarial drug resistance in Africa. 
"Sampling and testing activities should follow an
approved protocol with well defined objectives and have a dedicated budget line.",World Health Organization. (2022). Strategy to respond to antimalarial drug resistance in Africa. 
"The
post-market surveillance programme should be managed by a committee comprising
representatives from the national regulatory authority, ministry of health, National Malaria Programme , and other
relevant partners and stakeholders.",World Health Organization. (2022). Strategy to respond to antimalarial drug resistance in Africa. 
Quality standards should be enforced to ensure concrete results.,World Health Organization. (2022). Strategy to respond to antimalarial drug resistance in Africa. 
"A clear list of sanctions for
the manufacturing and wholesale purchase of substandard or falsified drugs (e.g. fines,
shop closures, withdrawal of import licenses) should be defined, and resources should be
dedicated to this purpose.",World Health Organization. (2022). Strategy to respond to antimalarial drug resistance in Africa. 
"The circulation of substandard and falsified drugs should be
closely monitored at borders and prevented through international and regional
collaboration.",World Health Organization. (2022). Strategy to respond to antimalarial drug resistance in Africa. 
"Political support and advocacy are key to ensure the
successful enforcement of any quality standards.",World Health Organization. (2022). Strategy to respond to antimalarial drug resistance in Africa. 
"Although harder to reach and to regulate, the private informal sector should be a
priority setting for the above-mentioned efforts, and relevant stakeholders should be
engaged and incentivized to support government initiatives.",World Health Organization. (2022). Strategy to respond to antimalarial drug resistance in Africa. 
"Pillar II - Intervention four: Remove non-recommended monotherapies and ensure that other
monotherapies are used in accordance with World Health Organization guidelines
Underlying issue
Although World Health Organization recommends the use of Artemisinin-based Combination Therapies to treat children and adults with uncomplicated
P. falciparum malaria, and the recommendations around the use of monotherapies should
be strictly followed to support resistance management, non-recommended monotherapies
remain an issue in Africa.",World Health Organization. (2022). Strategy to respond to antimalarial drug resistance in Africa. 
"In year two thousand and seven, World Health Organization Member States called for the progressive removal of oral artemisinin-based
monotherapies from markets, as these were identified as potential causes of resistance.",World Health Organization. (2022). Strategy to respond to antimalarial drug resistance in Africa. 
"Similarly, the continued availability and use of partner medicines as monotherapies (e.g.
amodiaquine, mefloquine) can compromise the value of Artemisinin-based Combination Therapies by selecting for drug
resistance.",World Health Organization. (2022). Strategy to respond to antimalarial drug resistance in Africa. 
"Despite significant progress, weak capacity to enforce the bans and continued
production and distribution by pharmaceutical companies have prevented the complete
withdrawal of the remaining non-recommended monotherapies from markets.",World Health Organization. (2022). Strategy to respond to antimalarial drug resistance in Africa. 
"Additionally,
non-pharmaceutical forms of Artemisia (e.g.",World Health Organization. (2022). Strategy to respond to antimalarial drug resistance in Africa. 
"Artemisia tea) are being used for the
prevention or treatment of malaria.",World Health Organization. (2022). Strategy to respond to antimalarial drug resistance in Africa. 
"Current knowledge concludes that any potential weak
antimalarial activity of compounds other than artemisinin in A. annua or A. afra would not
be sufficient to protect artemisinin from resistance.",World Health Organization. (2022). Strategy to respond to antimalarial drug resistance in Africa. 
"Parenteral or rectal monotherapies are recommended for treating severe malaria and when
oral treatments are not tolerated.",World Health Organization. (2022). Strategy to respond to antimalarial drug resistance in Africa. 
"Likewise, using monotherapies for patients with severe malaria without completing the full
recommended treatment (i.e. not administering a full Artemisinin-based Combination Therapy treatment following a parenteral
or rectal antimalarial treatment) presents a risk for resistance by favouring de novo
emergence and spread of resistant parasites.",World Health Organization. (2022). Strategy to respond to antimalarial drug resistance in Africa. 
"Anecdotal evidence suggests that non-recommended monotherapies could also be more
widely available and used in the private sector.",World Health Organization. (2022). Strategy to respond to antimalarial drug resistance in Africa. 
"Suggested interventions
Remove non-recommended oral monotherapies: countries should intensify their ongoing
efforts to remove non-recommended oral monotherapies from the market, including
from the informal sector, in order to reach complete withdrawal.",World Health Organization. (2022). Strategy to respond to antimalarial drug resistance in Africa. 
"Remedial action should
be considered at export, import and distribution levels.",World Health Organization. (2022). Strategy to respond to antimalarial drug resistance in Africa. 
"National regulatory authorities
should be empowered and strengthened to regulate and enforce the withdrawal of oral
monotherapies from markets, including both artemisinin-based and partner drugs.",World Health Organization. (2022). Strategy to respond to antimalarial drug resistance in Africa. 
"Moreover, national authorities should work with the main
importing stakeholders,
such as foreign governments, distributors and local manufacturers, to define a joint strategy to
withdraw non-recommended oral monotherapies from the market.",World Health Organization. (2022). Strategy to respond to antimalarial drug resistance in Africa. 
"At the continental level, regional organizations could work with exporting stakeholders
(e.g. governments, manufacturers).",World Health Organization. (2022). Strategy to respond to antimalarial drug resistance in Africa. 
"Strong collaboration among neighbouring
countries can ensure efficient surveillance of drug flows at borders.",World Health Organization. (2022). Strategy to respond to antimalarial drug resistance in Africa. 
"In areas where
frequent use of oral monotherapies is reported or suspected, stakeholder engagement
and communication
campaigns should be developed to raise awareness among private providers (e.g. pharmacies,
general retailers, clinics) on the risks associated with the use of these monotherapies.",World Health Organization. (2022). Strategy to respond to antimalarial drug resistance in Africa. 
"Similarly, the use of Artemisia herbal remedies should be avoided.",World Health Organization. (2022). Strategy to respond to antimalarial drug resistance in Africa. 
"Care providers and patients
should be sensitized to the risks incurred by patients and the threat to resistance management.",World Health Organization. (2022). Strategy to respond to antimalarial drug resistance in Africa. 
"Prevent the misuse of recommended artemisinin-based monotherapies: artemisinin-based
monotherapies (injectable and rectal) are only recommended for use in severe malaria
with specific follow-up care and treatment.",World Health Organization. (2022). Strategy to respond to antimalarial drug resistance in Africa. 
"These monotherapies should not be used for
the treatment of uncomplicated cases.",World Health Organization. (2022). Strategy to respond to antimalarial drug resistance in Africa. 
"Countries will need to conduct activities that
address the underlying root causes, including insufficient training and lack of
supervision; insufficient health system financing that encourages the prescription of
treatments that can be charged in full to the patient; wide availability and accessibility of
the treatments; and perception of efficacy.",World Health Organization. (2022). Strategy to respond to antimalarial drug resistance in Africa. 
"Health Care Workers should be trained to ensure broad
knowledge of guidelines on the treatment of uncomplicated malaria.",World Health Organization. (2022). Strategy to respond to antimalarial drug resistance in Africa. 
"A communication
plan could be developed to address communities' beliefs and personal preferences.",World Health Organization. (2022). Strategy to respond to antimalarial drug resistance in Africa. 
"Ensure complete treatment of severe malaria cases: patients with severe malaria who do not
receive the recommended Artemisinin-based Combination Therapy following the initial monotherapy may not be cured and
could contribute to the de novo emergence and spread of resistance.",World Health Organization. (2022). Strategy to respond to antimalarial drug resistance in Africa. 
"To address this risk,
Health Care Workers must be trained to follow the recommended treatment of severe malaria: a patient
treated with injectable artesunate or artemether should subsequently receive a full Artemisinin-based Combination Therapy
course, and a patient treated with rectal artesunate needs to be referred to a health facility
to receive, as needed, an injectable treatment followed by a full Artemisinin-based Combination Therapy course.",World Health Organization. (2022). Strategy to respond to antimalarial drug resistance in Africa. 
"Pillar II - Intervention 5: Promote equitable access to quality drugs
Underlying issue
Access to care can be affected by many factors, including geographical, financial, social
and gender barriers.",World Health Organization. (2022). Strategy to respond to antimalarial drug resistance in Africa. 
"For instance, out-of-pocket expenditures faced by poor people can result
in catastrophic health spending costs, use of non-recommended drugs, or choice to not use a
service (including Rapid Diagnostic Tests) or treatment.",World Health Organization. (2022). Strategy to respond to antimalarial drug resistance in Africa. 
"The lack of access to quality treatment can increase
the risk of resistance by encouraging the use of substandard or falsified drugs, thereby
increasing the number of parasites exposed to sub-therapeutic drug levels.",World Health Organization. (2022). Strategy to respond to antimalarial drug resistance in Africa. 
"Among other
characteristics, resistance has historically been observed to emerge first in areas and
populations with poor access to quality malaria services.",World Health Organization. (2022). Strategy to respond to antimalarial drug resistance in Africa. 
"In these areas, a large proportion
of patients seek treatment through private health care providers, especially pharmacies,
authorized and informal drug shops, and other medicine sellers.",World Health Organization. (2022). Strategy to respond to antimalarial drug resistance in Africa. 
"The quality of case
management in these facilities varies widely and is often poor, especially in terms of access
to quality Artemisinin-based Combination Therapies and malaria diagnostic testing prior to treatment.",World Health Organization. (2022). Strategy to respond to antimalarial drug resistance in Africa. 
"The private sector plays a
prominent role in some parts of Africa, but often operates without sufficient government or
regulatory oversight.",World Health Organization. (2022). Strategy to respond to antimalarial drug resistance in Africa. 
"The lack of alignment with national treatment guidelines can result in
the distribution of lower quality or inadequate products.",World Health Organization. (2022). Strategy to respond to antimalarial drug resistance in Africa. 
"Suggested interventions
Increase access to quality health services for underserved communities and populations: the
effect of the different barriers (e.g. geographical, financial, social, gender) on the
access to and choice of treatment, and the risk of resistance developing in different areas
and communities should be assessed country by country.",World Health Organization. (2022). Strategy to respond to antimalarial drug resistance in Africa. 
"Once specific groups have been
identified, efforts should be intensified to reach them.",World Health Organization. (2022). Strategy to respond to antimalarial drug resistance in Africa. 
"There are different ways of
achieving this, for instance by leveraging community workers to provide quality
diagnostics  and treatments to these specific groups.",World Health Organization. (2022). Strategy to respond to antimalarial drug resistance in Africa. 
"To minimize
financial barriers, policies could be developed to drive down the cost of treatments for
individual patients (e.g. private sector co-pay mechanisms, tax incentives on quality-
assured medicines).",World Health Organization. (2022). Strategy to respond to antimalarial drug resistance in Africa. 
"Improve access to quality care in the private sector: countries should ensure that only quality
antimalarial drugs and diagnostic testing are available from private providers.",World Health Organization. (2022). Strategy to respond to antimalarial drug resistance in Africa. 
"This is
achieved through adequate regulation and its enforcement by national and state regulatory
authorities.",World Health Organization. (2022). Strategy to respond to antimalarial drug resistance in Africa. 
"To address the issue of limited resources, mechanisms such as the Affordable
Medicines Facility for malaria programme, hosted by Global Fund to Fight AIDS, Tuberculosis and Malaria, should be explored.",World Health Organization. (2022). Strategy to respond to antimalarial drug resistance in Africa. 
"The
Affordable Medicines Facility for malaria subsidized Artemisinin-based Combination Therapies in the private sector and led to
tangible results in improving access to quality-assured Artemisinin-based Combination Therapies in that sector (with Artemisinin-based Combination Therapy
availability increasing by at least twenty percentage points in six of the eight pilot countries),
including among the poor.",World Health Organization. (2022). Strategy to respond to antimalarial drug resistance in Africa. 
"The programme also made Artemisinin-based Combination Therapies more affordable (with full Artemisinin-based Combination Therapy treatment course prices in the private sector dropping by one point two eight dollar to four point eight two dollar in six of the eight pilots)
If considered, similar initiatives should be further extended to diagnostic testing.",World Health Organization. (2022). Strategy to respond to antimalarial drug resistance in Africa. 
"Countries should
promote private providers' adherence to national treatment guidelines.",World Health Organization. (2022). Strategy to respond to antimalarial drug resistance in Africa. 
"For providers to deliver
quality case management in private health facilities, they must be supported by training,
supervision and protocols that are tailored to them and the
characteristics of the delivery channel.",World Health Organization. (2022). Strategy to respond to antimalarial drug resistance in Africa. 
"Engagement with community-based organizations and
nongovernmental organizations can be effective in bridging the gap between the public and
private sectors.",World Health Organization. (2022). Strategy to respond to antimalarial drug resistance in Africa. 
"Pillar II - Intervention 6: Promote equitable distribution of and access to high-quality
diagnostics to reduce drug pressure
Underlying issue
Given the non-specificity of malaria symptoms, the accuracy of clinical diagnosis tends to
be poor, which can lead to over-diagnosis and over-treatment of malaria; this in turn
unnecessarily increases drug pressure and the risk of resistance.",World Health Organization. (2022). Strategy to respond to antimalarial drug resistance in Africa. 
"According to household
surveys conducted in sub-Saharan Africa (year two thousand and fifteen-year two thousand and nineteen) among children under five years of age,
only thirty eight point five percent of those with fever and for whom care was sought received a diagnosis for
malaria.",World Health Organization. (2022). Strategy to respond to antimalarial drug resistance in Africa. 
"Malaria diagnosis should be made with either quality-assured malaria
microscopy or World Health Organization-prequalified
Rapid Diagnostic Tests.",World Health Organization. (2022). Strategy to respond to antimalarial drug resistance in Africa. 
"Microscopy must be performed by adequately trained Health Care Workers with well
maintained equipment.",World Health Organization. (2022). Strategy to respond to antimalarial drug resistance in Africa. 
"Rapid Diagnostic Test performance depends on many factors - not only
manufacturing quality, but also compliance with transport and storage requirements, and
training and supervision of operators.",World Health Organization. (2022). Strategy to respond to antimalarial drug resistance in Africa. 
"Suggested interventions
Promote access to and use of quality Rapid Diagnostic Tests: World Health Organization recommends parasitological confirmation of
infection of all suspected cases of malaria prior to treatment.",World Health Organization. (2022). Strategy to respond to antimalarial drug resistance in Africa. 
"Countries should promote
and assess adherence to the guidance on strengthening or setting up routine malaria
diagnostic services provided in Universal access to malaria diagnostic testing.",World Health Organization. (2022). Strategy to respond to antimalarial drug resistance in Africa. 
"Based on a
routine surveillance needs assessment, an adequate number of tests should be made
available to the population, including in the private sector.",World Health Organization. (2022). Strategy to respond to antimalarial drug resistance in Africa. 
"The quality of Rapid Diagnostic Tests should be
monitored and assessed through the implementation of post-market surveys.",World Health Organization. (2022). Strategy to respond to antimalarial drug resistance in Africa. 
"Improve the quality of microscopy: in year two thousand and sixteen, World Health Organization published the second version of the Malaria
microscopy quality assurance manual, which details the key requirements of a malaria
microscopy quality assurance programme.",World Health Organization. (2022). Strategy to respond to antimalarial drug resistance in Africa. 
"In parallel, World Health Organization published a complete series
of standard operating procedures for malaria microscopy.",World Health Organization. (2022). Strategy to respond to antimalarial drug resistance in Africa. 
"National Malaria Programme should ensure a central
coordination and advocacy effort, defining a reference (core) group of microscopists
with demonstrable expertise in overseeing programme training and validation standards.",World Health Organization. (2022). Strategy to respond to antimalarial drug resistance in Africa. 
"Before taking service, and on a regular basis after first being trained, microscopists
should receive quality training that includes competency standards that must be met
before they can work in a clinical setting, leveraging the World Health Organization Regional Office for
Africa External Competency Assessment for Malaria Microscopists.",World Health Organization. (2022). Strategy to respond to antimalarial drug resistance in Africa. 
"The quality of
processes and equipment should follow clear standard operating procedures, including
supplies of consumables and maintenance of microscopes and other equipment.",World Health Organization. (2022). Strategy to respond to antimalarial drug resistance in Africa. 
"Finally,
donors and partners should support National Malaria Programmes and allocate adequate budgets to improve the
quality of microscopy.",World Health Organization. (2022). Strategy to respond to antimalarial drug resistance in Africa. 
"Pillar II - Intervention 7: Empower patients, Health Care Workers and other stakeholders to make informed
decisions, and provide appropriate treatment
Underlying issue
Antimalarial drug resistance can result from a misalignment between treatment
recommendations and practice.",World Health Organization. (2022). Strategy to respond to antimalarial drug resistance in Africa. 
"The misuse or overuse of antimalarial treatments, due to
poor patient adherence and/or to incorrect prescription or treatment of unconfirmed cases
by care providers, contributes to drug resistance.",World Health Organization. (2022). Strategy to respond to antimalarial drug resistance in Africa. 
"In addition, safeguarding against
antimalarial drug resistance risks being done at the expense of other life-saving treatments.",World Health Organization. (2022). Strategy to respond to antimalarial drug resistance in Africa. 
"The rationalization of use of antimalarial treatments could result in excessive use of other
antimicrobial treatments (i.e. antibiotics).",World Health Organization. (2022). Strategy to respond to antimalarial drug resistance in Africa. 
"Suggested interventions
Raise awareness of populations and key stakeholders: raising awareness can be done through
the development and financing of a communication plan on the importance of quality
diagnosis, adherence to treatment, adherence to policy, and good practices.",World Health Organization. (2022). Strategy to respond to antimalarial drug resistance in Africa. 
"The messaging
needs to emphasize the importance of testing prior to administering antimalarial treatment,
adherence to the full treatment course, and the need for correct and quality treatment, for
instance by warning against the risk of using non-pharmaceutical forms of Artemisia.",World Health Organization. (2022). Strategy to respond to antimalarial drug resistance in Africa. 
"Specific stakeholders could also be targeted, for example by developing and distributing
dedicated communication materials about regulatory policies to private sector outlets.",World Health Organization. (2022). Strategy to respond to antimalarial drug resistance in Africa. 
"If
an Artemisinin-based Combination Therapy fails and a switch to a new treatment is required, public information and
education will be needed to ensure understanding and compliance with the new
guidelines.",World Health Organization. (2022). Strategy to respond to antimalarial drug resistance in Africa. 
