message,source
"Malaria is an infectious disease caused by the Plasmodium parasite, and it is transmitted through the bite of an infected female Anopheles mosquito.",FEDGEN-PHIS
Malaria is a life-threatening disease primarily found in tropical countries., WHO website
The risk of death for severe malaria is greatest in the first twenty four hours.,FMOH
"According to the World Health Organisation year two thousand and twenty four Malaria Report, Africa accounts for a more significant percentage of the world malaria burden,
accounting for ninety four percent and ninety five percent of estimated malaria cases and deaths worldwide in year two thousand and twenty three, with Nigeria at the forefront.",FEDGEN-PHIS
"Malaria is an acute febrile illness caused by Plasmodium parasites, which are spread
to people through the bites of infected female Anopheles mosquitoes.", WHO website
"Effective prevention strategies include using insecticide-treated nets, indoor residual spraying, and prompt access to antimalarial treatment.",FEDGEN-PHIS
"In year two thousand and twenty three, an estimated two hundred and sixty three million people contracted malaria in eighty three countries.", WHO website
"However, many individuals, particularly in low-income households, face significant barriers to implementing these preventive measures.",FEDGEN-PHIS
"The risk of malaria is increased by poverty, inadequate housing, and limited awareness.",FEDGEN-PHIS
"Low-income households often cannot afford mosquito-proofing measures, making them more susceptible to bites.",FEDGEN-PHIS
"It is preventable and curable.", WHO website
What is malaria and how is it transmitted?, WHO website
"However, without prompt diagnosis and effective treatment, a case of
uncomplicated malaria can progress to a severe form of the disease, which is often fatal without
treatment.", WHO website
"Malaria is not contagious and cannot spread from one person to another; the disease is
transmitted through the bites of female Anopheles mosquitoes.", WHO website
"Five species of parasites can
cause malaria in humans and 2 of these species – Plasmodium falciparum and Plasmodium
vivax – pose the greatest threat.", WHO website
"This risk of infection is higher in some areas than others depending on multiple factors,
including the type of local mosquitoes.", WHO website
"It may also vary according to the season, the risk being
highest during the rainy season in tropical countries.", WHO website
Who is at risk of malaria?, WHO website
Nearly half of the world’s population is at risk of malaria., WHO website
"That same year, the disease claimed approximately
five hundred and ninety seven thousand lives.", WHO website
Some people are more susceptible to developing severe malaria than others., WHO website
"Infants and
children under five years of age, pregnant women and patients with HIV/AIDS are at particular
risk.", WHO website
"Other vulnerable groups include people entering areas with intense malaria transmission who have not acquired partial immunity from long exposure to the disease, or who are not
taking chemopreventive therapies, such as migrants, mobile populations and travellers.", WHO website
Some people in areas where malaria is common will develop partial immunity., WHO website
"While it never
provides complete protection, partial immunity reduces the risk that malaria infection will
cause severe disease.", WHO website
"For this reason, most malaria deaths in Africa occur in young children, whereas in areas with less transmission and low immunity, all age groups are at risk.", WHO website
What are the symptoms and how is it diagnosed?, WHO website
"The first symptoms of malaria usually begin within 10–15 days after the bite from an infected
mosquito.", WHO website
"Fever, headache and chills are typically experienced, though these symptoms may
be mild and difficult to recognize as malaria.", WHO website
"In malaria endemic areas, people who have
developed partial immunity may become infected but experience no symptoms (asymptomatic
infections).", WHO website
World Health Organization recommends prompt diagnosis for anyone with suspected malaria., WHO website
"If Plasmodium
falciparum malaria is not treated within twenty four hours, the infection can progress to severe illness
and death.", WHO website
"Severe malaria can cause multi-organ failure in adults, while children frequently
suffer from severe anaemia, respiratory distress or cerebral malaria.", WHO website
"Human malaria caused by
other Plasmodium species can cause significant illness and occasionally life-threatening
disease.", WHO website
Malaria can be diagnosed using tests that determine the presence of the parasites causing the disease., WHO website
"There are two main types of tests: microscopic examination of blood smears and rapid
diagnostic tests.", WHO website
"Diagnostic testing enables health providers to distinguish malarial from other
causes of febrile illnesses, facilitating appropriate treatment.", WHO website
"What treatments are available for malaria
Malaria is a treatable disease.", WHO website
"Artemisinin-based combination therapies Artemisinin-based Combination Therapies are the most
effective antimalarial medicines available today and the mainstay of recommended treatment
for Plasmodium falciparum malaria, the deadliest malaria parasite globally.", WHO website
"Artemisinin-based Combination Therapies combine 2 active pharmaceuticals with different mechanisms of action, including
derivates of artemisinin extracted from the plant Artemisia annua and a partner drug.", WHO website
"The role of the artemisinin compound is to reduce the number of parasites during the first three days of treatment, while the role of the partner drug is to eliminate the remaining parasites.", WHO website
"As no alternative to artemisinin derivatives is expected to enter the market for several years,
the efficacy of Artemisinin-based Combination Therapies must be preserved, which is why World Health Organization recommends that treatment should
only be administered if a person tests positive for malaria.", WHO website
"World Health Organization does not support the
promotion or use of Artemisia plant material (whether teas, tablets or capsules) for the
prevention or treatment of malaria.", WHO website
"The emergence and spread of artemisinin partial resistance – defined as delayed clearance after
treatment with a drug containing an artemisinin – and resistance to Artemisinin-based Combination Therapy partner drugs are
significant threats to efforts aimed at reducing the global burden of malaria.", WHO website
"In Africa, artemisinin partial resistance is now confirmed in Eritrea, Rwanda, Uganda and the United Republic of Tanzania and is suspected in Ethiopia, Sudan, Namibia and Zambia.", WHO website
"Although studies generally show high efficacy of Artemisinin-based Combination Therapies, concerns remain regarding both the quality and
coverage of efficacy data.", WHO website
"As part of the World Health Organization strategy to respond to the threat of antimalarial
drug resistance in Africa, World Health Organization calls on malaria endemic countries and global malaria partners
to strengthen the surveillance of antimalarial drug efficacy and resistance, and to ensure that
the most effective treatments are selected for national treatment policy.", WHO website
Where is malaria most prevalent?, WHO website
Malaria occurs primarily in tropical and subtropical countries., WHO website
"The vast majority of malaria
cases and deaths are found in the World Health Organization African Region, with nearly all cases caused by the
Plasmodium falciparum parasite.", WHO website
"This parasite is also dominant in other malaria hotspots,
including the World Health Organization regions of South-East Asia, Eastern Mediterranean and Western Pacific.", WHO website
"In the World Health Organization Region of the Americas, the Plasmodium vivax parasite is predominant.", WHO website
"The threat of malaria is highest in sub-Saharan Africa, and four countries in that region accounted for over half of all malaria deaths worldwide in year two thousand and twenty three: Nigeria (thirty point nine percent ), the Democratic Republic of the Congo (eleven point three percent ), Niger (five point nine percent ) and the United Republic of Tanzania four point three percent).", WHO website
Is it dangerous to travel to places where malaria is endemic?, WHO website
People who have no partial immunity to malaria are at higher risk of contracting the disease., WHO website
"This includes travellers from non-endemic countries entering areas of high transmission as well
as people in malaria-endemic countries living in areas where there is little or no transmission.", WHO website
"As symptoms often do not present for ten to fifteen days after infection, travellers may return to
their home country before exhibiting signs of the disease.", WHO website
"Doctors in non-endemic areas may
not recognize the symptoms, causing potentially fatal delays in diagnosis and treatment.", WHO website
"In
addition, effective antimalarial drugs may not be registered or available in all countries.", WHO website
Chemoprophylaxis can be used as a preventive therapy prior to travelling in endemic areas., WHO website
"When combined with the use of insecticide-treated nets and the repeated application of a topical
repellent to prevent mosquito bites, it significantly lowers the risk of infection.", WHO website
"If a person has
taken chemoprophylaxis as a preventive measure, the same medicine should not be used for
treatment if infection occurs.", WHO website
"Travellers are encouraged to consult a doctor or their national disease control centre prior to
departure to determine the appropriate preventive measures.", WHO website
How can malaria be prevented?, WHO website
"Malaria is a preventable disease.
1.", WHO website
"Vector control is the main approach to prevent malaria and
reduce transmission.", WHO website
"Two forms of vector control are effective for people living in malaria-
endemic countries: insecticide-treated nets, which prevent bites while people sleep and which
kill mosquitoes as they try to feed, and indoor residual spraying, which is the application of an
insecticide to surfaces where mosquitoes tend to rest, such as internal walls, eaves and ceilings
of houses and other domestic structures.", WHO website
"For travellers, the use of an insecticide-treated net is
the most practical vector control intervention.", WHO website
"World Health Organization maintains a list vector control products
that have been assessed for their safety, effectiveness and quality.", WHO website
"Although designed to treat patients
already infected with malaria, some antimalarial medicines can also be used to prevent the
disease.", WHO website
"Current World Health Organization-recommended malaria chemopreventive therapies for people living in
endemic areas include intermittent preventive treatment of malaria in pregnancy, perennial
malaria chemoprevention, seasonal malaria chemoprevention, post-discharge malaria
chemoprevention, and intermittent preventive treatment of malaria for school-aged children.", WHO website
"Chemoprophylaxis drugs are also given to travellers before entering an area where malaria is
endemic and can be highly effective when combined with insecticide-treated nets.", WHO website
Is there a vaccine against malaria?, WHO website
"In year two thousand and twenty one, World Health Organization recommended the RTS,S/AS01 (RTS,S) vaccine to prevent malaria among
children living in regions with moderate-to-high P. falciparum malaria transmission.", WHO website
"The
vaccine has been shown to significantly reduce malaria, and deadly severe malaria, among
young children.", WHO website
"In October year two thousand and twenty three, World Health Organization recommended a second safe and effective malaria
vaccine, R21/Matrix-M.", WHO website
"Vaccines are now being rolled out in routine childhood immunization
programmes across Africa.", WHO website
"Malaria vaccines in Africa are expected to save tens of thousands
of young lives every year.", WHO website
"The highest impact will be achieved, however, when the vaccines
are introduced alongside a mix of other World Health Organization-recommended malaria interventions such as bed nets and chemoprophylaxis.", WHO website
"Can malaria be eliminated?
The vision of World Health Organization and the global malaria community is a world free of malaria.", WHO website
"This vision
will be achieved progressively by countries eliminating malaria from their territories and
implementing effective measures to prevent re-establishment of transmission.", WHO website
Malaria-endemic countries are situated at different points along the road to elimination., WHO website
"The
rate of progress depends on the strength of the national health system, the level of investment
in malaria elimination strategies and other factors, including biological determinants, the
environment and the social, demographic, political and economic realities of a particular
country.", WHO website
"Over the last two decades, significant progress has been achieved towards malaria elimination.", WHO website
"According to the latest World malaria report, twenty five countries had fewer than ten cases of the disease in year two thousand and twenty three, up from four countries in year two thousand.", WHO website
"Countries that have achieved at least 3 consecutive years of zero indigenous cases of malaria
(a case contracted locally with no evidence of importation from another endemic country) are eligible to apply for the World Health Organization certification of malaria elimination.", WHO website
"Since year two thousand and fifteen, fourteen countries
have been certified by the World Health Organization Director-General as malaria-free, including Maldives ( year two thousand and fifteen),
Sri Lanka (year two thousand and sixteen), Kyrgyzstan (year two thousand and sixteen), Paraguay (year two thousand and eighteen), Uzbekistan (year two thousand and eighteen), Argentina (year two thousand and nineteen),
Algeria (year two thousand and nineteen), El Salvador (year two thousand and twenty one), China (year two thousand and twenty one), Azerbaijan (year two thousand and twenty three), Tajikistan (year two thousand and twenty three), Cabo
Verde (year two thousand and twenty four), Egypt (year two thousand and twenty four) and Georgia (year two thousand and twenty five).", WHO website
What is the differences between malaria elimination and eradication?, WHO website
"Malaria elimination refers to the interruption of transmission in a given geographical area –
typically a country.", WHO website
"Malaria eradication refers to the complete interruption of malaria
transmission globally, in all countries.", WHO website
"Malaria vaccines (RTS,S and R21)
What is the malaria situation and who is most at risk?", WHO website
"Despite progress, efforts to control malaria face many challenges.", WHO website
"There were an estimated
two hundred and sixty three million new malaria cases and five hundred and ninety seven thousand malaria deaths globally in year two thousand and twenty three.", WHO website
"The World Health Organization African
Region continues to shoulder the heaviest malaria burden, comprising ninety four percent  of malaria cases
and ninety five percent  of malaria deaths globally.", WHO website
Children are particularly vulnerable; World Health Organization estimates that about four hundred and thirty two thousand African children died from malaria in year two thousand and twenty three., WHO website
"What is the World Health Organization recommendation for the RTS,S and R21 malaria vaccines?", WHO website
World Health Organization updated their recommendation for malaria vaccines in October year two thousand and twenty three., WHO website
"The updated recommendation is applicable to both RTS,S/AS01 and R21/Matrix-M malaria vaccines:
", WHO website
"World Health Organization recommends the use of malaria vaccines for the prevention of P.
falciparum malaria in children living in malaria endemic areas, prioritizing areas of
moderate and high transmission.
", WHO website
"The malaria vaccine should be provided in a schedule of 4 doses in children from
around 5 months of age. (Vaccination programmes may choose to give the first dose at
a later or slightly earlier age based on operational considerations.)
", WHO website
"A 5th dose, given one year after dose four, may be considered in areas of highly seasonal
transmission or where malaria risk remains high during the third year of life or beyond.
", WHO website
"In areas with highly seasonal malaria transmission or areas with perennial malaria
transmission with seasonal peaks, countries may consider providing the vaccine using
an age-based administration, seasonal administration, or a hybrid of these approaches.
", WHO website
"Countries should prioritize vaccination in areas of moderate and high transmission but
may also consider providing the vaccine in low transmission settings.", WHO website
"Decisions on
expanding to low transmission settings should be considered at a country level, based
on the overall malaria control strategy, cost-effectiveness, affordability, and
programmatic considerations. ", WHO website
"Malaria vaccines should be provided as part of a comprehensive malaria control
strategy.", WHO website
What do we know about the World Health Organization-recommended malaria vaccines?, WHO website
"As of October year two thousand and twenty three, both the RTS,S/AS01 and R21/Matrix-M vaccines are recommended by World Health Organization to prevent malaria in children.", WHO website
"Malaria vaccines should be provided to children in a
schedule of four doses from around five months of age.", WHO website
"Vaccination programmes may choose to give
the first dose at a later or slightly earlier age based on operational considerations.", WHO website
"The malaria vaccines act against P. falciparum, the deadliest malaria parasite globally and the
most prevalent in Africa.", WHO website
"The RTS,S malaria vaccine was first recommended by World Health Organization to prevent malaria in children in October year two thousand and twenty one.", WHO website
"The vaccine reached more than two million children in Ghana, Kenya and Malawi
through the Malaria Vaccine Implementation Programme from year two thousand and nineteen to year two thousand and twenty three.", WHO website
"Independent evaluations of the pilot introductions of the RTS,S vaccine in these three countries
demonstrated high public health impact: a vaccine-attributable thirteen percent  drop in mortality among
children age-eligible for vaccination; substantial reduction in hospitalizations for severe
malaria; and, improved access to at least one malaria prevention intervention (malaria vaccine
or insecticide treated net), reaching more than ninety percent  of children.", WHO website
"The pilot programme was
completed at the end of year two thousand and twenty three and all countries are continuing their malaria vaccination
programmes.", WHO website
"Both malaria vaccines are safe and efficacious, and both have been prequalified by World Health Organization.", WHO website
"In phase three clinical trials both vaccines reduced malaria cases by more than half during the first
year after vaccination – the period when children are at high risk of illness and death.", WHO website
A fourth vaccine dose given in the second year of life prolonged protection., WHO website
"Both vaccines reduce
malaria cases by seventy percent  when given seasonally in areas of highly seasonal transmission where
seasonal malaria chemoprevention is provided.", WHO website
"Highest impact is achieved when a combination of World Health Organization-recommended preventive, diagnostic,
and treatment strategies are used, tailored by the country to the local context.", WHO website
Roll out of malaria vaccines is well underway., WHO website
"By early April year two thousand and twenty five, nineteen countries had introduced the vaccine sub-nationally as part of routine childhood vaccinations, with scale-up and additional roll-outs planned throughout the year.", WHO website
"Tens of thousands of young lives could be saved every year with
scale up of these malaria vaccines.", WHO website
"How do the RTS,S and R21 malaria vaccines compare?", WHO website
"Both the R21 and RTS,S vaccines are shown to be safe and effective in preventing malaria in
children and are expected to have high public health impact.", WHO website
"RTS,S has been shown in large pilot implementations to substantially reduce malaria illness
and deaths in young children.", WHO website
"Given the similarity of the two malaria vaccines, it is likely that
R21 will also be highly impactful.", WHO website
"Tens of thousands of young lives could be saved every year
with the wide implementation of these malaria vaccines.", WHO website
"The R21 and RTS,S malaria vaccines have not been tested in a head to head trial.", WHO website
Both have been shown to reduce malaria cases by more than half during the first year after vaccination –this is the period when children are at highest risk of malaria illness and death., WHO website
A fourth dose prolongs the protection., WHO website
"Both vaccines prevent around 75 percent  of malaria episodes when given
seasonally in areas of highly seasonal transmission where seasonal malaria chemoprevention
is provided.", WHO website
There is no evidence to date showing one vaccine performs better than the other., WHO website
"The choice of product to be used in a country should be based on programmatic characteristics,
vaccine supply and vaccine affordability.", WHO website
"Gavi, the Vaccine Alliance, has established an
exceptional time limited co-financing policy for malaria vaccines, to increase affordability.", WHO website
Many Gavi-supported countries will pay as little as zero point two dollar per dose for either vaccine., WHO website
"Multiple modelling studies show cost-effectiveness of malaria vaccines according to standard
measures.", WHO website
"R21, which is currently less expensive than RTS,S, is estimated to have similar cost
effectiveness to other malaria control interventions, and both malaria vaccines are estimated to
be highly cost-effective when compared with other childhood vaccines.", WHO website
"Costing studies show
malaria vaccine introduction costs are similar to the costs of other new vaccines at introduction.", WHO website
"The RTS,S vaccine was prequalified by World Health Organization in July year two thousand and twenty two.", WHO website
"The R21 malaria vaccine was
prequalified by World Health Organization in December year two thousand and twenty three.", WHO website
"World Health Organization prequalification ensures vaccine safety and
quality.", WHO website
What is the status of malaria vaccines roll-out?, WHO website
"Rollout of the RTS,S and R21 malaria vaccines is well underway.", WHO website
"By early April year two thousand and twenty five, nineteen
countries in Africa (Benin, Burkina Faso, Burundi, Cameroon, Central African Republic, Côte
d’Ivoire, Chad, Democratic Republic of the Congo, Ghana, Kenya, Liberia, Malawi,
Mozambique, Niger, Nigeria, Sierra Leone, South Sudan, Sudan and Uganda) were offering
malaria vaccines as part of their childhood immunization programmes, and according to their
national malaria control plans.", WHO website
"Additional countries are expected to introduce and scale up
either RTS,S or R21 malaria vaccines in year two thousand and twenty five.", WHO website
"The status of introduction can be found on the
malaria vaccine introduction dashboard.", WHO website
Demand for the malaria vaccines is unprecedented., WHO website
"At least 30 countries in Africa plan to
introduce the malaria vaccine into their childhood immunization programmes and as part of
their national malaria control strategies.", WHO website
"With two malaria vaccines recommended and available, vaccine supply is expected to be
sufficient to meet the high demand.", WHO website
"What does the World Health Organization recommendation for two malaria vaccines mean for children at risk
of malaria?", WHO website
"The availability of two safe and effective malaria vaccines, RTS,S and R21, results in sufficient
vaccine supply to meet demand and benefit children living in areas where malaria is a major
public health risk.", WHO website
"According to modelling estimates, malaria vaccines could prevent
approximately half a million child deaths by year two thousand and thirty five if they were scaled up in moderate and high
malaria transmission areas.", WHO website
What about the MVIP: will the malaria vaccine pilots continue?, WHO website
"The Malaria Vaccine Implementation Programme in Ghana, Kenya and Malawi was
completed at the end of year two thousand and twenty three.", WHO website
"All three countries continued provision of malaria vaccination
through the childhood immunization programme with Gavi support
The MVIP was designed to evaluate the public health use of the RTS,S vaccine in Ghana,
Kenya and Malawi.", WHO website
"Between year two thousand and nineteen and year two thousand and twenty three, more than two million children were reached with
the malaria vaccine across the three countries, and implementation resulted in a substantial drop in
mortality (thirteen percent ) among children age-eligible for the vaccine, as well as a reduction in
hospitalizations for severe malaria.", WHO website
