message,source
"Understand the current behavioural drivers of care provider and patient choices.
- Care providers: Review information on the knowledge, attitudes and practices of care
providers (by provider type as available):
- Practices: This should include patterns of diagnosis, prescription and
communication to patients, including the role of traditional healers.
- Felt needs and preferences: This should include the preference for prescribing
certain types and dosages of treatment, perceived benefits of parasitological
diagnosis and malaria treatments, and perceived value in spending time to ensure
that patients understand the importance of taking the full treatment.
- Barriers and incentives that could affect the effectiveness of interventions:
This should include barriers to treating patients as per the national treatment
guidelines (e.g. availability of drugs), as well as incentives for providing
non- recommended treatments (e.g. financial).
- Patients: Review information on the knowledge, attitudes and practices of patients.
- Practices: This should include when and where treatment is sought, compliance to
prescribed treatment and use of vector control interventions.
- Knowledge and understanding: This should include knowledge of symptoms,
prevention, and the need for parasitological diagnosis and completion of the
seventy two B978correct treatment.
- Communication: This should include the main sources of information on
malaria prevention and treatment, and key challenges in communication (e.g.
language).
- Felt needs and preferences: This should include the preference for certain
sources, types and dosages of treatment, perceived benefits of parasitological
diagnosis and malaria treatments, perceived value in taking the full treatment,
and key perceived challenges in accessing quality treatment and vector control
interventions.
- Barriers and incentives that could affect the effectiveness of interventions: This
should include barriers making it difficult to seek treatment, as well as
incentives, for instance for taking the full treatment.",World Health Organization. (2022). Strategy to respond to antimalarial drug resistance in Africa. 
"Strengths and weaknesses of the health and regulatory systems: Assess the strengths of the health and
regulatory systems.
- Health care funding mix: Examples include the mix between donor-provided funds,
domestic public funding, private health insurance and out-of-pocket payments.
- Structure of care provision: This includes assessment of the role and importance of the
different sectors of care (e.g. public, private formal and informal sectors).
- Integrated delivery of care: Examples include the B982level of integration of care delivered
throughout the patient journey (e.g. referral to inpatient care) and across different
diseases (e.g. integrated community case management).
- Quality of care: Examples include indicators measuring coverage (e.g. universal
health coverage index), infrastructure (e.g. number of operating rooms) and health
outcomes (e.g. neonatal mortality).
- Human resources: Examples include the availability of resources (e.g. number of
nurses per one thousand people), distribution of Health Care Workers across the country and their level of
training.
- Health information systems and monitoring: Examples include assessment of the
systems and processes in place to monitor, analyse and evaluate ongoing
programmes.
- Procurement and supply management systems: Examples include planning and
projecting a country's health resource needs, the availability of pharmaceuticals and
supply of products to the facilities.
- National treatment guidelines and registration of essential medicines: Examples include
the inclusion of an Artemisinin-based Combination Therapy  as a second-line treatment.
- Enforcement capacity: Examples include the capacity to assess and proactively
monitor the quality of drugs and enforce sanctions.",World Health Organization. (2022). Strategy to respond to antimalarial drug resistance in Africa. 
"Understand the gap between the plans developed by the National Malaria Programme and their effective
implementation.
- Countries should rely on existing monitoring and evaluation frameworks and on
interviews with local, regional and global stakeholders to identify the bottlenecks
that have hindered past or ongoing implementation of interventions to fight malaria
(e.g. obstacles to the withdrawal of monotherapies).",World Health Organization. (2022). Strategy to respond to antimalarial drug resistance in Africa. 
"Identify synergies with other strategies and global plans.
- Identify interventions already being deployed within the framework of
other strategies that could be beneficial and further leveraged to respond
to antimalarial drug resistance, e.g. training and awareness campaigns
suggested in the Global action plan on antimicrobial resistance).
",World Health Organization. (2022).
" World Health Organisation data shows that children from wealthier families receive quicker medical care for fever than those from poorer households, highlighting health care access disparities,
hence a need for tailored responses to address the unique challenges faced by different populations.",FEDGEN-PHIS
Vaccines are biological substances that provide immunity/protection against specific diseases by stimulating the bodys immune system to recognize and kill the pathogen causing the disease.,FEDGEN-PHIS
"The malaria vaccines act against Plasmodium falciparum, the deadliest malaria parasite globally and the most prevalent in Africa.",FEDGEN-PHIS
"Despite the availability of preventive measures like insecticide-treated nets and antimalarial medications, the malaria vaccine represents a crucial advancement in the fight
against this disease, particularly in high-burden areas.",FEDGEN-PHIS
"Independent evaluations of the pilot introductions of the RTS S vaccine demonstrated a significant public health impact, including a vaccine- attributable thirteen percent drop in mortality among eligible children, a substantial reduction in
hospitalizations for severe malaria, and over ninety percent of children having access to at least one malaria prevention intervention, whether through the vaccine or ITNs.",FEDGEN-PHIS
The  World Health Organisation recommended that malaria vaccines be provided to children in four doses from around five months of age.,FEDGEN-PHIS
Vaccination programs may give the first dose at a later or slightly earlier age based on operational considerations.,FEDGEN-PHIS
"The development of malaria vaccines, such as the RTS and S/AS01 (Mosquirix), represents a significant advancement in preventive measures, aiming to reduce the incidence of malaria, especially in high-burden regions.",FEDGEN-PHIS
"Africa's capacity to prevent and manage infectious illnesses is influenced by vaccine sustainability and safety, which are essential aspects of public health on the continent.",FEDGEN-PHIS
The recent introduction of malaria vaccines in Africa represents a significant milestone in the fight against malaria.,FEDGEN-PHIS
"Ensuring their safety and sustainable deployment requires collaborative efforts among governments, international organizations, and local communities.",FEDGEN-PHIS
"Continued investment in vaccine production capacity, robust safety monitoring systems, and community engagement will be essential to reduce the malaria burden and improve public health outcomes across the continent.",FEDGEN-PHIS
"The two malaria vaccines the World Health Organisation has approved are RTS, S/AS01, and R21/Matrix-M, which were evaluated for safety and effectiveness through comprehensive clinical trials.",FEDGEN-PHIS
"In Ghana, Kenya, and Malawi, the RTS,S/AS01 vaccine has been given to more than two million children in trial programs, showing a good safety record.",FEDGEN-PHIS
"Significant adverse effects are uncommon, highlighting the vaccine's good safety record.",FEDGEN-PHIS
"Furthermore, recent research has demonstrated that the vaccine has no adverse effects on using bed nets or other childhood immunizations, both of which are essential elements of malaria prevention plans.",FEDGEN-PHIS
"Asserting that ""no one is safe until everyone is made safe by vaccination,"" the World Health Organisation highlights the need for everyone to have fair access to safe and effective
vaccines.",FEDGEN-PHIS
"The Vaccines for Africa Initiative, a  World Health Organisation-led initiative that raises awareness of the advantages of vaccines and disseminates evidence-based information on vaccine safety, is one of the
Vaccine Safety Net members that supports this.",FEDGEN-PHIS
"Researchers, alongside initiatives championing vaccine safety, can collaborate and carry out studies on the long-term effect of vaccine implementation within Africa.",FEDGEN-PHIS
Long-term disease control depends on maintaining a steady supply of malaria vaccinations.,FEDGEN-PHIS
"According to  World Health Organisation estimates, at least forty to sixty million doses of the malaria vaccine will be required annually by year two thousand and twenty six, and by  year two thousand and thirty, that number will rise to eighty to one hundred million doses yearly.",FEDGEN-PHIS
"Collaborations between governments, international organizations, and vaccine producers are crucial to meeting this need.",FEDGEN-PHIS
A one billion dollars project called the African Vaccine Manufacturing Accelerator was introduced in year two thousand and twenty four to increase the continent's capacity to produce vaccines.,FEDGEN-PHIS
This program aims to reduce disparities in vaccine access and strengthen pandemic preparedness by increasing Africa's vaccine production from two percent to sixty percent by year two thousand and forty.,FEDGEN-PHIS
Key factors influencing the long-term safety and efficacy of malaria vaccines are;,FEDGEN-PHIS
"The duration of immunity, the range of immune responses, and the difficulties of implementing malaria vaccines in endemic areas are major aspects that affect their long-term safety and effectiveness.",FEDGEN-PHIS
Vaccines that can retain high levels of security over longer periods are necessary for long-term efficacy and sustained malaria control.,FEDGEN-PHIS
"Effective vaccines must target multiple antigens to protect against different species of Plasmodium, the parasite that causes malaria.",FEDGEN-PHIS
"However, genetic differences in these antigens need to be considered.",FEDGEN-PHIS
"These differences can vary among Plasmodium strains, which may make vaccines less effective if they only target a few antigens.",FEDGEN-PHIS
"For a malaria vaccine to work well, it must consider these genetic differences to protect against many types of Plasmodium and provide lasting immunity.",FEDGEN-PHIS
"The immune response of the RTS,S/AS01E, which triggers CD4+ T cell responses and anti-CS protein antibodies, ought to comprise both humoral and cellular elements.",FEDGEN-PHIS
This is driving innovation of next-generation vaccine development to increase the robustness and range of immune responses.,FEDGEN-PHIS
"Community perception and acceptance rate of malaria vaccines in Africa Perception plays a crucial role in the adoption of malaria treatments in Africa, as cultural beliefs, misinformation, and trust in healthcare systems can significantly affect individuals' willingness to seek and follow medical advice.",FEDGEN-PHIS
"Negative perceptions or misunderstandings about specific treatments can hinder acceptance, even when these interventions are scientifically proven effective.",FEDGEN-PHIS
A review study published in March this year highlighted the varied perceptions of malaria vaccines across different African communities.,FEDGEN-PHIS
"In countries like Tanzania, only eleven percent of people were aware of the malaria vaccine, while in Nigeria, awareness was considerably higher at sixty percent.",FEDGEN-PHIS
"Despite this difference in awareness, many individuals were still willing to take the vaccine if it became available.",FEDGEN-PHIS
Acceptance rates ranged from thirty two point three percent in Ethiopia to ninety six percent in Sierra Leone.,FEDGEN-PHIS
"However, challenges such as vaccine availability, distribution issues, and misunderstandings about the vaccine's effectiveness were also identified.",FEDGEN-PHIS
"In another recent review of eleven studies involving fourteen thousand, six hundred and sixty six participants, the acceptance rate of the malaria vaccine among caregivers was examined.",FEDGEN-PHIS
"The study found that more than ninety percent of people, including mothers, were willing to accept the vaccine.",FEDGEN-PHIS
"Nigeria had the highest acceptance rate at ninety seven point six percent, followed by Ghana at ninety four point six percent and Tanzania at ninety two point five percent.",FEDGEN-PHIS
The study also found that mothers from the Igbo and other tribes were less likely to accept the vaccine.,FEDGEN-PHIS
"To increase acceptance, the study suggested the need for targeted interventions that consider cultural values and beliefs.",FEDGEN-PHIS
"In Nigeria, a study conducted in Enugu state by Chinawa et al. (year two thousand and twenty four) found that seventy two point one percent of respondents were aware of the malaria vaccine, witheighty three point one percent expressing a willingness to receive it.",FEDGEN-PHIS
"Among mothers, ninety two point nine percent were willing to vaccinate their babies, while eighty one point one percent were open to vaccinating themselves and their children.",FEDGEN-PHIS
"Interestingly, individuals from lower socio-economic backgrounds were five times less likely to vaccinate themselves and their children compared to those from higher socio-economic groups.",FEDGEN-PHIS
These findings highlight the importance of community perception in accepting malaria vaccines across Africa.,FEDGEN-PHIS
"While many people are willing to take the vaccine, factors such as awareness, cultural beliefs, socio-economic status, and trust in healthcare systems play key roles in influencing vaccine uptake.",FEDGEN-PHIS
Addressing these factors through targeted education and tailored interventions could significantly improve the region's acceptance and effectiveness of malaria vaccination programs.,FEDGEN-PHIS
"Nigeria Malaria Fact Sheet United States Embassy in Nigeria: Malaria affects three billion, three million people, or half of the worlds population, in one hundred and six countries and territories.",US Embassy in Nigeria
" World Health Organisation estimates two hundred and sixteen million cases of malaria occurred in year two thousand and ten, eighty one percent in the African region.",US Embassy in Nigeria
" World Health Organisation estimates there were six hundred and fifty five thousand malaria deaths in year two thousand and ten, ninety one percent in the African Region, and eighty six percent were children under five years of age.",US Embassy in Nigeria
"Malaria is the third leading cause of death for children under five years worldwide, after pneumonia and diarrheal disease.",US Embassy in Nigeria
Thirty countries in Sub-Saharan Africa account for ninety percent of global malaria deaths.,US Embassy in Nigeria
"Nigeria, Democratic Republic of Congo, Ethiopia, and Uganda account for nearly fifty percent of the global malaria deaths.",US Embassy in Nigeria
"Malaria is the second leading cause of death from infectious diseases in Africa, after HIV/AIDS.",US Embassy in Nigeria
Almost one out of five deaths of children under five in Africa is due to malaria.,US Embassy in Nigeria
"Malaria and HIV Malaria causes anemia which may require blood transfusions, a procedure that increases the risk for HIV infection where universal blood screening is yet to be achieved.",US Embassy in Nigeria
"People living with HIV/AIDS are at an increased risk of clinical malaria, severe illness, hospitalization, and death.",US Embassy in Nigeria
"Malaria contributes to a temporary increase in viral load among HIV-infected people which may worsen the clinical disease, increase mother-to child transmission, and augment transmission in adults.",US Embassy in Nigeria
Malaria in Nigeria Malaria is a major public health problem in Nigeria where it accounts for more cases and deaths than any other country in the world.,US Embassy in Nigeria
Malaria is a risk for ninety seven percent of Nigerias population.,US Embassy in Nigeria
The remaining three percent of the population live in the malaria free highlands.,US Embassy in Nigeria
There are an estimated one hundred million malaria cases with over three hundred thousand deaths per year in Nigeria.,US Embassy in Nigeria
This compares with two hundred and fifteen thousand deaths per year in Nigeria from HIV/AIDS.,US Embassy in Nigeria
Malaria contributes to an estimated eleven percent of maternal mortality.,US Embassy in Nigeria
Malaria accounts for sixty percent of outpatient visits and thirty percent of hospitalizations among children under five years of age in Nigeria.,US Embassy in Nigeria
"Malaria has the greatest prevalence, close to fifty percent, in children age six to fifty nine months in the South West, North Central, and North West regions.",US Embassy in Nigeria
"Malaria has the least prevalence, twenty seven point six percent, in children age six to fifty nine months in the South East region.",US Embassy in Nigeria
"Prevention programs focus on the distribution and use of bed nets, called Long Lasting Insecticidal Nets, including evidence-based health communication programs on the mode of malaria transmission and the importance of sleeping under ITNs.",US Embassy in Nigeria
"Indoor Residual Spraying involves the coordinated, timely spraying of the interior walls of homes with insecticides that kill mosquitoes.",US Embassy in Nigeria
Intermittent preventive treatment for pregnant women is an effective means of reducing the effects of malaria in both the pregnant woman and her unborn child by giving at least two doses of the drug sulfadoxine-pyrimethamine.,US Embassy in Nigeria
Artemisinin-based combination therapy has become the standard treatment of uncomplicated malaria.,US Embassy in Nigeria
Challenges and Gaps An estimated sixty five percent of Nigerias population lives in poverty and poverty is a major factor in malaria prevention and treatment.,US Embassy in Nigeria
"Vector control is highly dependent on a single class of insecticides, the pyrethroids.",US Embassy in Nigeria
Resistance to pyrethroids has been reported in twenty seven countries in sub-Saharan Africa.,US Embassy in Nigeria
"Despite the National policy of Artemisinin-based Combination Therapy  as the first-line treatment of uncomplicated malaria, MIS year two thousand and ten indicates that over seventy percent of children treated for malaria in Nigeria received chloroquine or SP.",US Embassy in Nigeria
Non  U.S. Funding: The World Bank provided one hundred and eighty million dollars for the Malaria Booster Program that supports seven states and some national-level activities.,US Embassy in Nigeria
The World Bank provided an additional one hundred million dollars for this program in year two thousand and nine.,US Embassy in Nigeria
"The UK Department For International Development initiated SuNMaP (Support to Nigeria Malaria Programme), a one hundred million dollars, five-year program to control malaria in year two thousand and eight.",US Embassy in Nigeria
The Global Fund provided a five hundred million dollars Round eight Malaria grant that began in year two thousand and nine and will last until year two thousand and fourteen.,US Embassy in Nigeria
"U.S. PMI Funding: The U.S. PMI was launched in June year two thousand and five as a five- year, one billion, two million dollars initiative to scale up malaria prevention and treatment interventions, and has been extended through year two thousand and fifteen.",US Embassy in Nigeria
PMI is led by the U.S. Agency for International Development and implemented together with the U.S. Centers for Disease Control and Prevention.,US Embassy in Nigeria
"The goal of PMI, working closely with host governments, is to reduce malaria-related mortality by seventy percent in the original fifteen countries by the end of year two thousand and fifteen.",US Embassy in Nigeria
"Over the years, the Federal Government has put several interventions in place to control the scourge of the disease, one of which is the improvement of malaria case management at all levels.",FMOH
A major threat to these efforts however was the emergence of resistance to available antimalarial medicines such as chloroquine and Sulphadoxine-Pyrimethamine.,FMOH
The Drug Therapeutic Efficacy Tests on chloroquine and Sulphadoxine-Pyrimethamine in the six epidemiological zones in year two thousand and two evidently showed the inability of these medicines to completely clear malaria parasites in the blood.,FMOH
"The introduction in year two thousand and five, of Artemisinin based Combination Therapy Artemisinin-based Combination Therapies as treatment of uncomplicated malaria following the failure of chloroquine and Sulphadoxine-Pyrimethamine revolutionalized the treatment of malaria in the country.",FMOH
Presently Artemisinin-based Combination Therapies are the most efficacious antimalarial treatment available globally.,FMOH
"In a renewed effort to control, the disease, emphasis has shifted from the vulnerable groups to the entire population at risk.",FMOH
"In this case, colour coded and pre-packaged antimalarial medicines will now be deployed to the public sector and also at highly reduced cost to the private sector.",FMOH
"By so doing, the medicines will be made available and affordable to the general populace.",FMOH
"One of the major highlights in the newly reviewed policy is the promotion of parasite based diagnosis in all age groups; in which case, all suspected cases of malaria shall be appropriately diagnosed where available, before treatment.",FMOH
This is expected to protect the medicine while also saving cost.,FMOH
"This updated guideline provides comprehensive information on chemoprophylaxis, preventive treatment, diagnosis and treatment of malaria as recommended by the countrys National Policy on Diagnosis and Treatment of Malaria.",FMOH
The use of this document is therefore expected to provide information that will lead to the improvement in the management of malaria illness both at the health facility and at community levels.,FMOH
The guideline would be widely disseminated to health care facilities,FMOH
"Accordingly, it is imperative for the health care providers in the country to strictly comply with this guideline to harmonize malaria management practices within the country.",FMOH
It is our hope that this document will provide the necessary guide required for the effective management of malaria in Nigeria.,FMOH
Asexual parasitaemia: The presence in host red blood cells of asexual parasites.,FMOH
"Cerebral malaria: Severe P. falciparum malaria with cerebral manifestations, usually including coma (Glasgow coma scale less than  eleven, Blantyre coma scale less than  three).",FMOH
Malaria with coma persisting for greater than  thirty minute after a seizure is considered to be cerebral malaria.,FMOH
Cure: Elimination of the symptoms and asexual blood stages of the malaria parasite that caused the patient or caregiver to seek treatment.,FMOH
Resistance to antimalarials arises because of the selection of parasites with genetic mutations or gene amplifications that confer reduced susceptibility.,FMOH
Gametocytes: Sexual stages of malaria parasites present in the host red blood cells.,FMOH
A dark brown granular pigment formed by malaria parasites as a by-product of haemoglobin catabolism.,FMOH
The pigment is evident in mature trophozoites and schizonts.,FMOH
They may also be present in white blood cells (peripheral monocytes and polymorphonuclear neutrophils) and in the placenta.,FMOH
Monotherapy: Antimalarial treatment with a single medicine (either a single active compound or a synergistic combination of two compounds with related mechanism of action).,FMOH
Plasmodium: A genus of protozoan vertebrate blood parasites that includes the causal agents of malaria.,FMOH
"Plasmodium falciparum, P. malariae, P. ovale and P. vivax cause malaria in humans.",FMOH
"Human infections with the monkey malaria parasite, P. knowlesi have also been reported from forested regions of South-East Asia.",FMOH
"Rapid diagnostic test: An antigen-based stick, cassette or card test for malaria in which a coloured line indicates that plasmodial antigens have been detected.",FMOH
Recurrence: The recurrence of asexual parasitaemia following treatment.,FMOH
"This can be caused by a recrudescence, a relapse (in P. vivax and P. ovale infections only) or a new infection.",FMOH
Recrudescence: The recurrence of asexual parasitaemia after treatment of the infection with the same infection that caused the original illness.,FMOH
This results from incomplete clearance of parasitaemia due to inadequate or ineffective treatment.,FMOH
"It is, therefore, different to a relapse in P. vivax and P. ovale infections, and it differs from a new infection or re-infection (as identified by molecular genotyping in endemic areas).",FMOH
Relapse: The recurrence of asexual parasitaemia in P. vivax and P. ovale malaria deriving from persisting liver stages.,FMOH
Relapse occurs when the blood stage infection has been eliminated but hypnozoites persist in the liver and mature to form hepatic schizonts.,FMOH
"After variable intervals of weeks to months, the hepatic schizonts burst and liberate merozoites into the bloodstream.",FMOH
Severe anaemia: Haemoglobin concentration of less than 5 gram per one hundred millilitre (haematocrit less than  fifteen percent).,FMOH
Severe falciparum malaria: Acute falciparum malaria with signs of severity and/or evidence of vital organ dysfunction.,FMOH
